{
  "$schema": "http://json-schema.org/draft-07/schema#",
  "title": "Coder Output Schema",
  "description": "Framework-level coder agent output schema. Files changed, test results, lint results, memory updates, acceptance verification.",
  "type": "object",
  "required": ["metadata", "taskId", "filesChanged", "testResults", "memoryUpdates"],
  "properties": {
    "metadata": {
      "type": "object",
      "required": ["coderVersion", "generatedAt", "taskId"],
      "properties": {
        "coderVersion": { "type": "string" },
        "generatedAt": { "type": "string", "format": "date-time" },
        "taskId": { "type": "string", "pattern": "^TASK-[0-9]{3,}$" }
      }
    },
    "taskId": { "type": "string", "pattern": "^TASK-[0-9]{3,}$" },
    "filesChanged": {
      "type": "array",
      "minItems": 1,
      "items": {
        "type": "object",
        "required": ["path", "changeType", "summary"],
        "properties": {
          "path": { "type": "string" },
          "changeType": { "type": "string", "enum": ["created", "modified", "deleted"] },
          "summary": { "type": "string", "minLength": 10 }
        }
      }
    },
    "testResults": {
      "type": "object",
      "required": ["total", "passed", "failed", "skipped"],
      "properties": {
        "total": { "type": "integer", "minimum": 0 },
        "passed": { "type": "integer", "minimum": 0 },
        "failed": { "type": "integer", "minimum": 0 },
        "skipped": { "type": "integer", "minimum": 0 },
        "details": {
          "type": "array",
          "items": {
            "type": "object",
            "properties": {
              "name": { "type": "string" },
              "result": { "type": "string", "enum": ["passed", "failed", "skipped"] },
              "duration": { "type": "string" }
            }
          }
        }
      }
    },
    "lintResults": {
      "type": "object",
      "properties": {
        "passed": { "type": "boolean" },
        "errors": { "type": "integer", "minimum": 0 },
        "warnings": { "type": "integer", "minimum": 0 }
      }
    },
    "memoryUpdates": {
      "type": "array",
      "items": {
        "type": "object",
        "required": ["category", "record"],
        "properties": {
          "category": {
            "type": "string",
            "enum": ["decisions", "architecture", "completedTasks", "bugs", "conventions", "risks"]
          },
          "record": { "type": "object" }
        }
      }
    },
    "acceptanceVerification": {
      "type": "array",
      "items": {
        "type": "object",
        "required": ["criterion", "verified", "evidence"],
        "properties": {
          "criterion": { "type": "string" },
          "verified": { "type": "boolean" },
          "evidence": { "type": "string" }
        }
      }
    },
    "decisions": {
      "type": "array",
      "items": {
        "type": "object",
        "required": ["description", "rationale"],
        "properties": {
          "description": { "type": "string", "minLength": 10 },
          "rationale": { "type": "string", "minLength": 20 }
        }
      }
    }
  }
}
