{
  "metadata": {
    "coderVersion": "healing-cycle",
    "generatedAt": "2026-06-21T08:44:08.528Z",
    "taskId": "TASK-001"
  },
  "taskId": "TASK-001",
  "filesChanged": [
    {
      "path": "src/healing-fix.js",
      "changeType": "modified",
      "summary": "Auto-healing fix attempt 3/3 derived from: Execution layer mock path used for local validation."
    }
  ],
  "testResults": {
    "total": 1,
    "passed": 1,
    "failed": 0,
    "skipped": 0,
    "details": [
      {
        "name": "healing-cycle-smoke-test",
        "result": "passed",
        "duration": "0s"
      }
    ]
  },
  "lintResults": {
    "passed": true,
    "errors": 0,
    "warnings": 0
  },
  "memoryUpdates": [
    {
      "category": "bugs",
      "record": {
        "description": "Auto-healing attempt 3 for TASK-001",
        "rootCause": "Execution layer mock path used for local validation.",
        "fixDescription": "Generated an automatic fix pass from debugger output.",
        "severity": "P2-medium"
      }
    }
  ]
}